{
  "$schema": "https://json-schema.org/draft/2020-12/schema",
  "$id": "https://raw.githubusercontent.com/bbororo5/cloud-usage-billing/main/contracts/v1/instance-usage-event.schema.json",
  "title": "Instance Usage Event v1",
  "type": "object",
  "required": [
    "specversion",
    "id",
    "source",
    "type",
    "subject",
    "time",
    "datacontenttype",
    "dataschema",
    "data"
  ],
  "properties": {
    "specversion": { "const": "1.0" },
    "id": { "type": "string", "format": "uuid" },
    "source": {
      "type": "string",
      "pattern": "^urn:cloud-usage:meter:[A-Za-z0-9._-]+$"
    },
    "type": {
      "const": "io.github.bbororo5.cloudusage.instance.usage.v1"
    },
    "subject": {
      "type": "string",
      "pattern": "^instances/[A-Za-z0-9._-]+$"
    },
    "time": { "$ref": "#/$defs/millisecondTimestamp" },
    "datacontenttype": { "const": "application/json" },
    "dataschema": { "const": "https://raw.githubusercontent.com/bbororo5/cloud-usage-billing/main/contracts/v1/instance-usage-event.schema.json" },
    "data": {
      "type": "array",
      "minItems": 3,
      "maxItems": 3,
      "items": {
        "oneOf": [
          { "$ref": "#/$defs/computeRecord" },
          { "$ref": "#/$defs/storageRecord" },
          { "$ref": "#/$defs/networkRecord" }
        ]
      },
      "allOf": [
        {
          "contains": { "$ref": "#/$defs/computeRecord" },
          "minContains": 1,
          "maxContains": 1
        },
        {
          "contains": { "$ref": "#/$defs/storageRecord" },
          "minContains": 1,
          "maxContains": 1
        },
        {
          "contains": { "$ref": "#/$defs/networkRecord" },
          "minContains": 1,
          "maxContains": 1
        }
      ]
    }
  },
  "additionalProperties": false,
  "$defs": {
    "millisecondTimestamp": {
      "type": "string",
      "format": "date-time",
      "description": "Project precision limit: omit fractional seconds or use at most three digits; never round or truncate on ingestion.",
      "pattern": "^[0-9]{4}-[0-9]{2}-[0-9]{2}[Tt][0-9]{2}:[0-9]{2}:[0-9]{2}(\\.[0-9]{1,3})?([Zz]|[+-][0-9]{2}:[0-9]{2})$"
    },
    "baseRecord": {
      "type": "object",
      "required": [
        "ChargePeriodStart",
        "ChargePeriodEnd",
        "RegionId",
        "ResourceId",
        "ResourceType",
        "Meter",
        "ConsumedQuantity",
        "ConsumedUnit"
      ],
      "properties": {
        "ChargePeriodStart": { "$ref": "#/$defs/millisecondTimestamp" },
        "ChargePeriodEnd": { "$ref": "#/$defs/millisecondTimestamp" },
        "RegionId": { "const": "kr-central-1" },
        "ResourceId": { "type": "string", "minLength": 1 },
        "ResourceType": { "const": "Virtual Machine" },
        "ConsumedQuantity": { "type": "integer", "minimum": 0, "maximum": 18446744073709551615 }
      }
    },
    "computeRecord": {
      "type": "object",
      "allOf": [
        { "$ref": "#/$defs/baseRecord" },
        {
          "type": "object",
          "properties": {
            "Meter": { "const": "Compute Usage" },
            "ConsumedUnit": { "const": "Second" }
          }
        }
      ],
      "unevaluatedProperties": false
    },
    "storageRecord": {
      "type": "object",
      "allOf": [
        { "$ref": "#/$defs/baseRecord" },
        {
          "type": "object",
          "properties": {
            "Meter": { "const": "Block Volume Usage" },
            "ConsumedUnit": { "const": "GiB-Second" }
          }
        }
      ],
      "unevaluatedProperties": false
    },
    "networkRecord": {
      "type": "object",
      "allOf": [
        { "$ref": "#/$defs/baseRecord" },
        {
          "type": "object",
          "properties": {
            "Meter": { "const": "Data Transfer" },
            "ConsumedUnit": { "const": "Byte" }
          }
        }
      ],
      "unevaluatedProperties": false
    }
  }
}
